{
  "completion": {
    "protocol_valid": true,
    "status": "completed",
    "total_cost": 4.0,
    "total_steps": 3
  },
  "episode_start": {
    "available_tools": [
      "search_visual",
      "search_speech",
      "search_ambient_audio",
      "inspect_clip",
      "read_transcript",
      "get_channel_status",
      "finalize"
    ],
    "budget": {
      "cost_limit": 12.0,
      "max_steps": 10
    },
    "episode_id": "syn_f06_motor_identity.blocked",
    "family_id": "syn_f06_motor_identity",
    "protocol_version": "0.2.0",
    "question": "What ambient machine sound occurred, and how many click pulses sounded later?",
    "state_role": "BLOCKED",
    "tool_costs": {
      "finalize": 0.0,
      "get_channel_status": 0.25,
      "inspect_clip": 2.0,
      "read_transcript": 1.0,
      "search_ambient_audio": 1.0,
      "search_speech": 1.0,
      "search_visual": 1.0
    },
    "video_duration_s": 360.0
  },
  "events": [
    {
      "action": {
        "action": {
          "arguments": {
            "include_audio": true,
            "include_video": false,
            "interval": {
              "end_s": 282.0,
              "start_s": 276.0
            }
          },
          "tool": "inspect_clip"
        },
        "belief_state": {
          "missing_hop_types": [
            "ambient_event",
            "temporal_order"
          ],
          "missing_modality_probabilities": {
            "ambient": 0.97,
            "speech": 0.02,
            "vision": 0.02
          },
          "missingness_cause_probabilities": {
            "evidence_accessible_but_not_found": 0.02,
            "evidence_in_source_but_inaccessible": 0.94,
            "not_missing": 0.01,
            "source_evidence_absent": 0.01,
            "uncertain": 0.02
          },
          "next_action_rationale": "Acquire validator evidence route s3_two_clicks.",
          "p_sufficient": 0.03,
          "verdict": "insufficient"
        },
        "episode_id": "syn_f06_motor_identity.blocked",
        "protocol_version": "0.2.0",
        "request_id": "validator-synthetic_validator_b.r0000",
        "step_index": 0
      },
      "active_hook_ids": [],
      "event_type": "tool_exchange",
      "recorded_at": "2000-08-22T12:01:45Z",
      "response": {
        "backend_version": "synthetic-fixed-v1",
        "cost_charged": 2.0,
        "cost_remaining": 10.0,
        "cost_used_total": 2.0,
        "episode_id": "syn_f06_motor_identity.blocked",
        "error": {
          "code": "NO_RESULTS",
          "message": "No accessible clip observation matched.",
          "retry_after_step": null,
          "retryable": false
        },
        "protocol_version": "0.2.0",
        "request_id": "validator-synthetic_validator_b.r0000",
        "response_hash": "sha256:645e0627040ddeb3e70a70b1e625ed6e5f248c83f234b6b2bd4a1328f03680e2",
        "results": [],
        "status": "not_found",
        "step_index": 0,
        "tool": "inspect_clip"
      }
    },
    {
      "action": {
        "action": {
          "arguments": {
            "include_audio": true,
            "include_video": false,
            "interval": {
              "end_s": 118.0,
              "start_s": 110.0
            }
          },
          "tool": "inspect_clip"
        },
        "belief_state": {
          "missing_hop_types": [
            "ambient_event",
            "temporal_order"
          ],
          "missing_modality_probabilities": {
            "ambient": 0.97,
            "speech": 0.02,
            "vision": 0.02
          },
          "missingness_cause_probabilities": {
            "evidence_accessible_but_not_found": 0.02,
            "evidence_in_source_but_inaccessible": 0.94,
            "not_missing": 0.01,
            "source_evidence_absent": 0.01,
            "uncertain": 0.02
          },
          "next_action_rationale": "Acquire validator evidence route s3_motor.",
          "p_sufficient": 0.03,
          "verdict": "insufficient"
        },
        "episode_id": "syn_f06_motor_identity.blocked",
        "protocol_version": "0.2.0",
        "request_id": "validator-synthetic_validator_b.r0001",
        "step_index": 1
      },
      "active_hook_ids": [],
      "event_type": "tool_exchange",
      "recorded_at": "2000-08-22T12:01:46Z",
      "response": {
        "backend_version": "synthetic-fixed-v1",
        "cost_charged": 2.0,
        "cost_remaining": 8.0,
        "cost_used_total": 4.0,
        "episode_id": "syn_f06_motor_identity.blocked",
        "error": {
          "code": "NO_RESULTS",
          "message": "No accessible clip observation matched.",
          "retry_after_step": null,
          "retryable": false
        },
        "protocol_version": "0.2.0",
        "request_id": "validator-synthetic_validator_b.r0001",
        "response_hash": "sha256:9044cd21502f8918b3d076e9cba5a85f04cc4c108022437a886b5a1247d872b3",
        "results": [],
        "status": "not_found",
        "step_index": 1,
        "tool": "inspect_clip"
      }
    },
    {
      "action": {
        "action": {
          "arguments": {
            "answer_mode": "abstain",
            "claims": [],
            "diagnosis": {
              "cause_probabilities": {
                "evidence_accessible_but_not_found": 0.02,
                "evidence_in_source_but_inaccessible": 0.94,
                "not_missing": 0.01,
                "source_evidence_absent": 0.01,
                "uncertain": 0.02
              },
              "description": "Required source evidence exists but the registered route is inaccessible.",
              "hop_types": [
                "ambient_event",
                "temporal_order"
              ],
              "modality_probabilities": {
                "ambient": 0.97,
                "speech": 0.02,
                "vision": 0.02
              },
              "recovery_route_declared": false
            },
            "natural_language_answer": "",
            "p_sufficient": 0.03,
            "termination_reason": "no_recovery_route",
            "verdict": "insufficient"
          },
          "tool": "finalize"
        },
        "belief_state": {
          "missing_hop_types": [
            "ambient_event",
            "temporal_order"
          ],
          "missing_modality_probabilities": {
            "ambient": 0.97,
            "speech": 0.02,
            "vision": 0.02
          },
          "missingness_cause_probabilities": {
            "evidence_accessible_but_not_found": 0.02,
            "evidence_in_source_but_inaccessible": 0.94,
            "not_missing": 0.01,
            "source_evidence_absent": 0.01,
            "uncertain": 0.02
          },
          "next_action_rationale": "No accepted SES is reachable; record the blocked access diagnosis.",
          "p_sufficient": 0.03,
          "verdict": "insufficient"
        },
        "episode_id": "syn_f06_motor_identity.blocked",
        "protocol_version": "0.2.0",
        "request_id": "validator-synthetic_validator_b.r0002",
        "step_index": 2
      },
      "active_hook_ids": [],
      "event_type": "finalize",
      "recorded_at": "2000-08-22T12:01:47Z"
    }
  ],
  "final_output": {
    "answer_mode": "abstain",
    "claims": [],
    "diagnosis": {
      "cause_probabilities": {
        "evidence_accessible_but_not_found": 0.02,
        "evidence_in_source_but_inaccessible": 0.94,
        "not_missing": 0.01,
        "source_evidence_absent": 0.01,
        "uncertain": 0.02
      },
      "description": "Required source evidence exists but the registered route is inaccessible.",
      "hop_types": [
        "ambient_event",
        "temporal_order"
      ],
      "modality_probabilities": {
        "ambient": 0.97,
        "speech": 0.02,
        "vision": 0.02
      },
      "recovery_route_declared": false
    },
    "natural_language_answer": "",
    "p_sufficient": 0.03,
    "termination_reason": "no_recovery_route",
    "verdict": "insufficient"
  },
  "replay": {
    "backend_hash": "sha256:ec9e8aebeda3c32a864c59d5638ae5bd2c6b596132f0cd2678239560c9dd7c50",
    "backend_version": "synthetic-fixed-v1",
    "intervention_manifest_hash": "sha256:6b76c5341c8381d58afaf0f96073494a7e0f932026241bc8ff505b420ddbd8cc",
    "replay_seed": 20260905,
    "trajectory_hash": "sha256:6985a6fb2f7062d1a0c9d231dabce635c9323f178484d3d20a6866e96b25b703"
  },
  "schema_version": "0.2.0",
  "track": "EXTERNAL_COMPATIBILITY_UNPOOLED",
  "trajectory_id": "traj.validator-synthetic_validator_b.syn_f06_motor_identity.blocked"
}
