{
  "completion": {
    "protocol_valid": true,
    "status": "completed",
    "total_cost": 3.0,
    "total_steps": 3
  },
  "episode_start": {
    "available_tools": [
      "search_visual",
      "search_speech",
      "search_ambient_audio",
      "inspect_clip",
      "read_transcript",
      "get_channel_status",
      "finalize"
    ],
    "budget": {
      "cost_limit": 12.0,
      "max_steps": 10
    },
    "episode_id": "syn_f04_star_bin.blocked",
    "family_id": "syn_f04_star_bin",
    "protocol_version": "0.2.0",
    "question": "Which visible symbol was shown, and which bin did the later instruction name?",
    "state_role": "BLOCKED",
    "tool_costs": {
      "finalize": 0.0,
      "get_channel_status": 0.25,
      "inspect_clip": 2.0,
      "read_transcript": 1.0,
      "search_ambient_audio": 1.0,
      "search_speech": 1.0,
      "search_visual": 1.0
    },
    "video_duration_s": 300.0
  },
  "events": [
    {
      "action": {
        "action": {
          "arguments": {
            "include_word_timestamps": false,
            "interval": {
              "end_s": 252.0,
              "start_s": 246.0
            },
            "source": "asr"
          },
          "tool": "read_transcript"
        },
        "belief_state": {
          "missing_hop_types": [
            "cross_modal_binding",
            "event_detection",
            "speech_content"
          ],
          "missing_modality_probabilities": {
            "ambient": 0.02,
            "speech": 0.97,
            "vision": 0.97
          },
          "missingness_cause_probabilities": {
            "evidence_accessible_but_not_found": 0.02,
            "evidence_in_source_but_inaccessible": 0.94,
            "not_missing": 0.01,
            "source_evidence_absent": 0.01,
            "uncertain": 0.02
          },
          "next_action_rationale": "Acquire validator evidence route s2_speech_bin.",
          "p_sufficient": 0.03,
          "verdict": "insufficient"
        },
        "episode_id": "syn_f04_star_bin.blocked",
        "protocol_version": "0.2.0",
        "request_id": "validator-synthetic_validator_b.r0000",
        "step_index": 0
      },
      "active_hook_ids": [],
      "event_type": "tool_exchange",
      "recorded_at": "2000-08-22T12:01:45Z",
      "response": {
        "backend_version": "synthetic-fixed-v1",
        "cost_charged": 1.0,
        "cost_remaining": 11.0,
        "cost_used_total": 1.0,
        "episode_id": "syn_f04_star_bin.blocked",
        "error": null,
        "protocol_version": "0.2.0",
        "request_id": "validator-synthetic_validator_b.r0000",
        "response_hash": "sha256:5a34b6080a236be33d36634e35c42bd91fd002b7256a6262bcac76246252a11c",
        "results": [
          {
            "interval": {
              "end_s": 252.0,
              "start_s": 246.0
            },
            "modalities": [
              "speech"
            ],
            "observation_id": "obs.transcript.asr.07d32d723f1af5b7a4f087d951b987f1530b8f5708ea940210e274f64918c0bd",
            "payload": {
              "_route_refs": [
                "sha256:b80b58e70416aa4a73ecabaad20b7a219287a87f6a25a70dbfe8ee6723f91b2e"
              ],
              "audio_event": "operator says PLACE IN BIN FOUR",
              "audio_parameters": {
                "frequency_hz": 587,
                "kind": "speech_token"
              },
              "description": "operator says PLACE IN BIN FOUR",
              "text": "The operator says PLACE IN BIN FOUR.",
              "transcript_source": "asr"
            },
            "payload_hash": "sha256:e7dc6d690eed832d1a4e48211cb9264e45ebc6d206d2aaca39db42c05dc15ba7",
            "result_type": "observation"
          }
        ],
        "status": "ok",
        "step_index": 0,
        "tool": "read_transcript"
      }
    },
    {
      "action": {
        "action": {
          "arguments": {
            "include_audio": false,
            "include_video": true,
            "interval": {
              "end_s": 98.0,
              "start_s": 92.0
            }
          },
          "tool": "inspect_clip"
        },
        "belief_state": {
          "missing_hop_types": [
            "cross_modal_binding",
            "event_detection",
            "speech_content"
          ],
          "missing_modality_probabilities": {
            "ambient": 0.02,
            "speech": 0.02,
            "vision": 0.97
          },
          "missingness_cause_probabilities": {
            "evidence_accessible_but_not_found": 0.02,
            "evidence_in_source_but_inaccessible": 0.94,
            "not_missing": 0.01,
            "source_evidence_absent": 0.01,
            "uncertain": 0.02
          },
          "next_action_rationale": "Acquire validator evidence route s2_yellow_star.",
          "p_sufficient": 0.03,
          "verdict": "insufficient"
        },
        "episode_id": "syn_f04_star_bin.blocked",
        "protocol_version": "0.2.0",
        "request_id": "validator-synthetic_validator_b.r0001",
        "step_index": 1
      },
      "active_hook_ids": [],
      "event_type": "tool_exchange",
      "recorded_at": "2000-08-22T12:01:46Z",
      "response": {
        "backend_version": "synthetic-fixed-v1",
        "cost_charged": 2.0,
        "cost_remaining": 9.0,
        "cost_used_total": 3.0,
        "episode_id": "syn_f04_star_bin.blocked",
        "error": {
          "code": "VISUAL_CHANNEL_UNAVAILABLE",
          "message": "The requested channel is unavailable.",
          "retry_after_step": null,
          "retryable": true
        },
        "protocol_version": "0.2.0",
        "request_id": "validator-synthetic_validator_b.r0001",
        "response_hash": "sha256:dd609d8fad1500b8793ec9d3f6fa1a4880de2af54da13d861f3669c575728735",
        "results": [],
        "status": "channel_unavailable",
        "step_index": 1,
        "tool": "inspect_clip"
      }
    },
    {
      "action": {
        "action": {
          "arguments": {
            "answer_mode": "abstain",
            "claims": [],
            "diagnosis": {
              "cause_probabilities": {
                "evidence_accessible_but_not_found": 0.02,
                "evidence_in_source_but_inaccessible": 0.94,
                "not_missing": 0.01,
                "source_evidence_absent": 0.01,
                "uncertain": 0.02
              },
              "description": "Required source evidence exists but the registered route is inaccessible.",
              "hop_types": [
                "cross_modal_binding",
                "event_detection",
                "speech_content"
              ],
              "modality_probabilities": {
                "ambient": 0.02,
                "speech": 0.02,
                "vision": 0.97
              },
              "recovery_route_declared": false
            },
            "natural_language_answer": "",
            "p_sufficient": 0.03,
            "termination_reason": "no_recovery_route",
            "verdict": "insufficient"
          },
          "tool": "finalize"
        },
        "belief_state": {
          "missing_hop_types": [
            "cross_modal_binding",
            "event_detection",
            "speech_content"
          ],
          "missing_modality_probabilities": {
            "ambient": 0.02,
            "speech": 0.02,
            "vision": 0.97
          },
          "missingness_cause_probabilities": {
            "evidence_accessible_but_not_found": 0.02,
            "evidence_in_source_but_inaccessible": 0.94,
            "not_missing": 0.01,
            "source_evidence_absent": 0.01,
            "uncertain": 0.02
          },
          "next_action_rationale": "No accepted SES is reachable; record the blocked access diagnosis.",
          "p_sufficient": 0.03,
          "verdict": "insufficient"
        },
        "episode_id": "syn_f04_star_bin.blocked",
        "protocol_version": "0.2.0",
        "request_id": "validator-synthetic_validator_b.r0002",
        "step_index": 2
      },
      "active_hook_ids": [],
      "event_type": "finalize",
      "recorded_at": "2000-08-22T12:01:47Z"
    }
  ],
  "final_output": {
    "answer_mode": "abstain",
    "claims": [],
    "diagnosis": {
      "cause_probabilities": {
        "evidence_accessible_but_not_found": 0.02,
        "evidence_in_source_but_inaccessible": 0.94,
        "not_missing": 0.01,
        "source_evidence_absent": 0.01,
        "uncertain": 0.02
      },
      "description": "Required source evidence exists but the registered route is inaccessible.",
      "hop_types": [
        "cross_modal_binding",
        "event_detection",
        "speech_content"
      ],
      "modality_probabilities": {
        "ambient": 0.02,
        "speech": 0.02,
        "vision": 0.97
      },
      "recovery_route_declared": false
    },
    "natural_language_answer": "",
    "p_sufficient": 0.03,
    "termination_reason": "no_recovery_route",
    "verdict": "insufficient"
  },
  "replay": {
    "backend_hash": "sha256:ec9e8aebeda3c32a864c59d5638ae5bd2c6b596132f0cd2678239560c9dd7c50",
    "backend_version": "synthetic-fixed-v1",
    "intervention_manifest_hash": "sha256:a9c5670968e00b52bf8e33f3407e7b2d02dd8e4a70a04646f4482c9d4e321aae",
    "replay_seed": 20260905,
    "trajectory_hash": "sha256:09237dd9722feee9c5c9bf333233d90e3cdba2c669640ec94f81a84c1ae2ac87"
  },
  "schema_version": "0.2.0",
  "track": "EXTERNAL_COMPATIBILITY_UNPOOLED",
  "trajectory_id": "traj.validator-synthetic_validator_b.syn_f04_star_bin.blocked"
}
