{
  "completion": {
    "protocol_valid": true,
    "status": "completed",
    "total_cost": 4.0,
    "total_steps": 3
  },
  "episode_start": {
    "available_tools": [
      "search_visual",
      "search_speech",
      "search_ambient_audio",
      "inspect_clip",
      "read_transcript",
      "get_channel_status",
      "finalize"
    ],
    "budget": {
      "cost_limit": 12.0,
      "max_steps": 10
    },
    "episode_id": "syn_f01_visual_order.blocked",
    "family_id": "syn_f01_visual_order",
    "protocol_version": "0.2.0",
    "question": "Which shape appeared first, and which shape appeared later?",
    "state_role": "BLOCKED",
    "tool_costs": {
      "finalize": 0.0,
      "get_channel_status": 0.25,
      "inspect_clip": 2.0,
      "read_transcript": 1.0,
      "search_ambient_audio": 1.0,
      "search_speech": 1.0,
      "search_visual": 1.0
    },
    "video_duration_s": 240.0
  },
  "events": [
    {
      "action": {
        "action": {
          "arguments": {
            "include_audio": false,
            "include_video": true,
            "interval": {
              "end_s": 182.0,
              "start_s": 176.0
            }
          },
          "tool": "inspect_clip"
        },
        "belief_state": {
          "missing_hop_types": [
            "event_detection",
            "temporal_order"
          ],
          "missing_modality_probabilities": {
            "ambient": 0.02,
            "speech": 0.02,
            "vision": 0.97
          },
          "missingness_cause_probabilities": {
            "evidence_accessible_but_not_found": 0.02,
            "evidence_in_source_but_inaccessible": 0.94,
            "not_missing": 0.01,
            "source_evidence_absent": 0.01,
            "uncertain": 0.02
          },
          "next_action_rationale": "Acquire validator evidence route s1_green_circle.",
          "p_sufficient": 0.03,
          "verdict": "insufficient"
        },
        "episode_id": "syn_f01_visual_order.blocked",
        "protocol_version": "0.2.0",
        "request_id": "validator-synthetic_validator_b.r0000",
        "step_index": 0
      },
      "active_hook_ids": [],
      "event_type": "tool_exchange",
      "recorded_at": "2000-08-22T12:01:45Z",
      "response": {
        "backend_version": "synthetic-fixed-v1",
        "cost_charged": 2.0,
        "cost_remaining": 10.0,
        "cost_used_total": 2.0,
        "episode_id": "syn_f01_visual_order.blocked",
        "error": {
          "code": "NO_RESULTS",
          "message": "No accessible clip observation matched.",
          "retry_after_step": null,
          "retryable": false
        },
        "protocol_version": "0.2.0",
        "request_id": "validator-synthetic_validator_b.r0000",
        "response_hash": "sha256:a8200d2e7b476c4d7137baf563e8695ac4cb6341b03bf7dd6db7e201a5d1403a",
        "results": [],
        "status": "not_found",
        "step_index": 0,
        "tool": "inspect_clip"
      }
    },
    {
      "action": {
        "action": {
          "arguments": {
            "include_audio": false,
            "include_video": true,
            "interval": {
              "end_s": 30.0,
              "start_s": 24.0
            }
          },
          "tool": "inspect_clip"
        },
        "belief_state": {
          "missing_hop_types": [
            "event_detection",
            "temporal_order"
          ],
          "missing_modality_probabilities": {
            "ambient": 0.02,
            "speech": 0.02,
            "vision": 0.97
          },
          "missingness_cause_probabilities": {
            "evidence_accessible_but_not_found": 0.02,
            "evidence_in_source_but_inaccessible": 0.94,
            "not_missing": 0.01,
            "source_evidence_absent": 0.01,
            "uncertain": 0.02
          },
          "next_action_rationale": "Acquire validator evidence route s1_blue_triangle.",
          "p_sufficient": 0.03,
          "verdict": "insufficient"
        },
        "episode_id": "syn_f01_visual_order.blocked",
        "protocol_version": "0.2.0",
        "request_id": "validator-synthetic_validator_b.r0001",
        "step_index": 1
      },
      "active_hook_ids": [],
      "event_type": "tool_exchange",
      "recorded_at": "2000-08-22T12:01:46Z",
      "response": {
        "backend_version": "synthetic-fixed-v1",
        "cost_charged": 2.0,
        "cost_remaining": 8.0,
        "cost_used_total": 4.0,
        "episode_id": "syn_f01_visual_order.blocked",
        "error": null,
        "protocol_version": "0.2.0",
        "request_id": "validator-synthetic_validator_b.r0001",
        "response_hash": "sha256:a4ba2c63e1540dd2e901cf35a0b13bfbec538d93796dc63820604cdc279daeb7",
        "results": [
          {
            "interval": {
              "end_s": 30.0,
              "start_s": 24.0
            },
            "modalities": [
              "vision"
            ],
            "observation_id": "obs.clip.a786fb1f6fb36dff61b69033085d9ca1fe532616513ed1dd61d39c0fc767bea7",
            "payload": {
              "_route_refs": [
                "sha256:109e1653caa9e06948d638588e66c1bc72888b5db4fffa64b598515766dd4c7e"
              ],
              "description": "BLUE TRIANGLE",
              "inspection": {
                "include_audio": false,
                "include_video": true,
                "inspected_duration_s": 6.0,
                "requested_interval": {
                  "end_s": 30.0,
                  "start_s": 24.0
                }
              }
            },
            "payload_hash": "sha256:3e9db15fddaa21979e6eff180233acfd3d5c1aa40a992ec2d42531346a60176d",
            "result_type": "observation"
          }
        ],
        "status": "ok",
        "step_index": 1,
        "tool": "inspect_clip"
      }
    },
    {
      "action": {
        "action": {
          "arguments": {
            "answer_mode": "abstain",
            "claims": [],
            "diagnosis": {
              "cause_probabilities": {
                "evidence_accessible_but_not_found": 0.02,
                "evidence_in_source_but_inaccessible": 0.94,
                "not_missing": 0.01,
                "source_evidence_absent": 0.01,
                "uncertain": 0.02
              },
              "description": "Required source evidence exists but the registered route is inaccessible.",
              "hop_types": [
                "event_detection",
                "temporal_order"
              ],
              "modality_probabilities": {
                "ambient": 0.02,
                "speech": 0.02,
                "vision": 0.97
              },
              "recovery_route_declared": false
            },
            "natural_language_answer": "",
            "p_sufficient": 0.03,
            "termination_reason": "no_recovery_route",
            "verdict": "insufficient"
          },
          "tool": "finalize"
        },
        "belief_state": {
          "missing_hop_types": [
            "event_detection",
            "temporal_order"
          ],
          "missing_modality_probabilities": {
            "ambient": 0.02,
            "speech": 0.02,
            "vision": 0.97
          },
          "missingness_cause_probabilities": {
            "evidence_accessible_but_not_found": 0.02,
            "evidence_in_source_but_inaccessible": 0.94,
            "not_missing": 0.01,
            "source_evidence_absent": 0.01,
            "uncertain": 0.02
          },
          "next_action_rationale": "No accepted SES is reachable; record the blocked access diagnosis.",
          "p_sufficient": 0.03,
          "verdict": "insufficient"
        },
        "episode_id": "syn_f01_visual_order.blocked",
        "protocol_version": "0.2.0",
        "request_id": "validator-synthetic_validator_b.r0002",
        "step_index": 2
      },
      "active_hook_ids": [],
      "event_type": "finalize",
      "recorded_at": "2000-08-22T12:01:47Z"
    }
  ],
  "final_output": {
    "answer_mode": "abstain",
    "claims": [],
    "diagnosis": {
      "cause_probabilities": {
        "evidence_accessible_but_not_found": 0.02,
        "evidence_in_source_but_inaccessible": 0.94,
        "not_missing": 0.01,
        "source_evidence_absent": 0.01,
        "uncertain": 0.02
      },
      "description": "Required source evidence exists but the registered route is inaccessible.",
      "hop_types": [
        "event_detection",
        "temporal_order"
      ],
      "modality_probabilities": {
        "ambient": 0.02,
        "speech": 0.02,
        "vision": 0.97
      },
      "recovery_route_declared": false
    },
    "natural_language_answer": "",
    "p_sufficient": 0.03,
    "termination_reason": "no_recovery_route",
    "verdict": "insufficient"
  },
  "replay": {
    "backend_hash": "sha256:ec9e8aebeda3c32a864c59d5638ae5bd2c6b596132f0cd2678239560c9dd7c50",
    "backend_version": "synthetic-fixed-v1",
    "intervention_manifest_hash": "sha256:2464cbbfd6bbd60b0d7d20fd53a93295d210d3a8fe7431ea289647459a463d71",
    "replay_seed": 20260905,
    "trajectory_hash": "sha256:2fc547b815cef66b381fd646cbc64a2adbb87756847271b568e1c53a380734d2"
  },
  "schema_version": "0.2.0",
  "track": "EXTERNAL_COMPATIBILITY_UNPOOLED",
  "trajectory_id": "traj.validator-synthetic_validator_b.syn_f01_visual_order.blocked"
}
